{
  "run_id": "2026-10-22-operations",
  "date": "2026-10-22",
  "commit": "3fae8a7",
  "scope": [
    "05-final-project/observability/ (monitoring stack, alert, app telemetry export)",
    "05-final-project/incident-response/ (responder, evidence collection, autonomy policy, runbooks, incident records)",
    "backend dependencies added for OpenTelemetry (backend/uv.lock)",
    "the 2026-10-22 staging game day (INC-20261022-175440-staging)"
  ],
  "tools": [
    {
      "name": "semgrep 1.180.0",
      "kind": "deterministic",
      "config": "p/python p/javascript p/typescript p/react p/dockerfile p/github-actions p/secrets (run-semgrep.sh); 150 files, including the 51 new ones",
      "output": "semgrep.json"
    },
    {
      "name": "pip-audit 2.10.1",
      "kind": "dependency",
      "config": "backend runtime deps from uv.lock (backend-requirements.txt), now 41 packages with the OpenTelemetry SDK and exporter",
      "output": "pip-audit.json"
    },
    {
      "name": "claude-opus-5-5 (Claude Code)",
      "kind": "model-review",
      "config": "read observability/, incident-response/, the incident records and the responder's agent command; questions: what can the responder read, change and leak, and who can reach it",
      "output": "inline"
    },
    {
      "name": "claude -p probes (claude-haiku-5-5)",
      "kind": "manual-test",
      "config": "three headless runs with the responder's tool set, each asked to read a file it must not: /etc/hostname (outside the repo), an in-repo file under a deny rule, and backend/.env.example under the final deny list",
      "output": "inline"
    }
  ],
  "findings": [
    {
      "id": "F13",
      "source": "pip-audit",
      "rule": "PYSEC-2026-4320 / GHSA-6q48-6c7w-9gw2",
      "title": "certifi 2026.8.x trusts compromised emSign intermediate CAs",
      "severity": "low",
      "scanner_severity": "not rated",
      "count": 1,
      "locations": ["backend/uv.lock (certifi, pulled in by the OTLP exporter via requests)"],
      "evidence": "The CI security-scan job failed on the first push of the observability branch. certifi is only used by requests inside the OTLP HTTP exporter, which talks plain HTTP to the collector on the Docker network, so no TLS connection relied on the bad roots.",
      "disposition": "fixed",
      "rationale": "Not exploitable here, but the upgrade is trivial and a red security-scan job blocks everything else.",
      "fix": "certifi 2026.10.19 (commit 76da157, PR #24). pip-audit in this run: 41 packages, 0 known vulnerabilities.",
      "decided_by": "owner (merged PR #24, 2026-10-22)"
    },
    {
      "id": "F14",
      "source": "model-review",
      "rule": "visitor-ip-in-public-record",
      "title": "Visitors' IP addresses reached the incident record, which is committed to a public repo",
      "severity": "medium",
      "count": 1,
      "locations": ["incident-response/collect-evidence.sh (container.log, Loki/Tempo results)"],
      "evidence": "The first test run of the responder copied an internet scanner's IP from the container's access log into evidence/container.log and into the model's summary. Incident folders are committed and the repository is public.",
      "disposition": "fixed",
      "rationale": "Personal data in a public repo, and once committed it is in history for good. Redacting before the model sees the evidence also keeps it out of the model's own text.",
      "fix": "collect-evidence.sh replaces every public IPv4 address with <public-ip> in every evidence file before the agent runs; private and loopback addresses stay. That test incident was deleted. Both committed incidents contain only 127.0.0.1 and private addresses (checked with a grep for dotted quads).",
      "decided_by": "proposed: claude-opus-5-5"
    },
    {
      "id": "F15",
      "source": "model-review",
      "rule": "agent-read-scope",
      "title": "The responder's agent reads attacker-controlled text and its answer is published",
      "severity": "medium",
      "count": 1,
      "locations": ["incident-response/responder.py (run_agent)", "incident-response/responder-task.md"],
      "evidence": "Request paths in container.log come from anyone on the internet, and the agent's summary is committed to a public repo. A prompt injection that made the agent Read a secret and quote it would publish it. Probes with the responder's tool set: headless claude denied a Read of /etc/hostname (outside the repo); a --disallowedTools Read() rule denied an in-repo file; the final deny list denied backend/.env.example and allowed README.md. No real .env file exists inside the repo checkout on the server; prod.env and staging.env are in /srv/card-catalog with mode 600.",
      "disposition": "fixed",
      "rationale": "Headless mode already refuses reads outside the working directory, but that depends on the user's Claude Code settings. An explicit deny list holds even if those settings are loosened, and covers a secrets file that someone might one day put inside the repo.",
      "fix": "run_agent passes --permission-mode default and --disallowedTools with Read() deny rules for /srv, ~/.claude, ~/.config, ~/.ssh, ~/.aws, ~/setup, every .env/.env.*/prod.env/staging.env and *.db. The agent has no Bash, Edit, Write or network tool, and its output is only a schema-checked proposal: policy.py decides, so an injection can at most cause one unneeded staging rollback per hour, or a prod proposal that waits for a human.",
      "decided_by": "proposed: claude-opus-5-5"
    },
    {
      "id": "F16",
      "source": "model-review",
      "rule": "grafana-default-admin",
      "title": "Grafana uses admin/admin, and the evidence collector logs in with it",
      "severity": "low",
      "count": 1,
      "locations": ["observability/compose.yaml", "incident-response/collect-evidence.sh"],
      "evidence": "Grafana is published on 127.0.0.1:3000 only (compose.yaml) and is reached through an SSH tunnel. Anyone who can reach it already has a shell on the host.",
      "disposition": "accepted-risk",
      "rationale": "The stack runs only for short periods on a resized host. GRAFANA_ADMIN_PASSWORD and GRAFANA_AUTH override both defaults if Grafana is ever exposed or kept running.",
      "decided_by": "proposed: claude-opus-5-5"
    },
    {
      "id": "F17",
      "source": "model-review",
      "rule": "responder-webhook-bind",
      "title": "The responder's webhook listens on all interfaces, port 8001",
      "severity": "low",
      "count": 1,
      "locations": ["incident-response/responder.py (Handler.do_POST, main)"],
      "evidence": "Grafana reaches it through host.docker.internal from a Docker bridge network, so it can't bind to loopback only. The handler answers 403 to any client that isn't a private or loopback address, before reading the body, and caps the body at 1 MB. A forged alert from inside the host would still only start the same evidence → proposal → policy pipeline. The EC2 security group was not checked in this run (the instance metadata query was refused by the agent's auto mode).",
      "disposition": "accepted-risk",
      "rationale": "Code-enforced client check; TCP source addresses can't be usefully spoofed over the internet; the worst case is a policy-bounded staging rollback.",
      "decided_by": "proposed: claude-opus-5-5"
    },
    {
      "id": "F18",
      "source": "manual-test",
      "rule": "deploy-any-image",
      "title": "deploy.sh deploys any image, including one built locally that never passed CI",
      "severity": "low",
      "count": 1,
      "locations": ["deploy/deploy.sh (deploy)"],
      "evidence": "The game day deployed a locally built image (df9cbe0) to staging. Its bug is caught by the unit suite (test_move_position_past_end_appends), but nothing on the server checks that an image came from the CI-gated build. The deploy smoke test passed because it never moves a card. Running deploy.sh needs a shell on the host, so this is a gap in defence in depth, not an exposure.",
      "disposition": "deferred",
      "rationale": "Proposed fix for the owner: deploy.sh accepts only ghcr.io/spycebot/card-catalog images whose commit is on main with a green CI run (or verify an attestation), and the smoke test logs in and moves a card. Both are follow-ups from the incident.",
      "decided_by": "proposed: claude-opus-5-5"
    }
  ]
}
